{
  "$schema": "https://json-schema.org/draft/2020-12/schema",
  "$id": "https://github.com/DemchaAV/graphcompose-ai-flow/schemas/revision.schema.json",
  "title": "Revision",
  "description": "Per-revision metadata. Lives at examples/<project>/revisions/<id>/revision.json. Mirrors the TemplateProject ↔ Revision contract used by tools/revision-manager and consumed by tools/preview-renderer, tools/visual-diff, and the agent prompts.",
  "type": "object",
  "additionalProperties": false,
  "required": ["id", "parentRevisionId", "status", "userRequest", "targetGraphComposeVersion", "skillPack", "createdAt", "artifacts"],
  "properties": {
    "id": {
      "type": "string",
      "pattern": "^revision-\\d{3,}$",
      "description": "Sequential revision identifier (revision-001, revision-002, ...)."
    },
    "parentRevisionId": {
      "type": ["string", "null"],
      "description": "Parent revision the diff and rollback model are computed against; null for the first revision in a chain."
    },
    "status": {
      "type": "string",
      "enum": ["DRAFT", "APPROVED", "REJECTED", "SUPERSEDED", "FAILED", "REVERTED"],
      "description": "Revision lifecycle state. Owned by tools/revision-manager — agents must never mutate this directly."
    },
    "userRequest": {
      "type": "string",
      "minLength": 1,
      "description": "Verbatim user gesture that opened this revision (single-line summary)."
    },
    "scope": {
      "type": "string",
      "enum": ["visual-change", "refactor-only", "data-only", "asset-only", "theme-only"],
      "description": "Optional scope marker the orchestrator writes per prompts/orchestrator-agent.md § Revision scope. Five values, each gating a different agent subchain and a different Visual Review gate: visual-change (full pipeline → layer-by-layer review vs reference image); refactor-only (Template Coder + Test+Render → binary AE==0 vs parent); data-only (Test+Render only → region-aware AE on affected regions, AE==0 elsewhere); asset-only (Asset Resolver + Test+Render → region-aware AE on affected regions, AE==0 elsewhere); theme-only (Template Coder theme file + Test+Render → layer-by-layer vs reference image)."
    },
    "targetGraphComposeVersion": {
      "type": "string",
      "pattern": "^v?\\d+\\.\\d+(\\.\\d+)?(-[A-Za-z0-9.]+)?$",
      "description": "GraphCompose version pin used to compile and render this revision."
    },
    "skillPack": {
      "type": "string",
      "pattern": "^skills/versions/.+$",
      "description": "Repo-relative path to the skill pack folder used by the agents."
    },
    "changedComponents": {
      "type": "array",
      "items": { "type": "string", "minLength": 1 },
      "uniqueItems": true,
      "description": "Optional list of named private render methods whose output this revision modified — feeds the selective rollback model."
    },
    "createdAt": {
      "type": "string",
      "format": "date-time",
      "description": "ISO 8601 UTC timestamp when this revision was opened."
    },
    "artifacts": {
      "type": "object",
      "minProperties": 1,
      "additionalProperties": { "type": "string", "minLength": 1 },
      "description": "Artifact label → filename map (relative to the revision folder). Labels are well-known but the schema is open so the orchestrator can add new artifact types."
    },
    "pendingArtifacts": {
      "type": "array",
      "items": { "type": "string", "minLength": 1 },
      "uniqueItems": true,
      "description": "Artifact filenames the revision declares but has not yet produced. The repository-contract gate tolerates a missing artifact only when it is listed here."
    },
    "templateDisplayName": {
      "type": "string",
      "minLength": 1,
      "description": "Optional human-readable name the template publisher uses. Present once the revision becomes the source of a published template under templates/."
    },
    "approvedAt": {
      "type": "string",
      "format": "date-time",
      "description": "ISO 8601 timestamp Revision Manager writes when status flips to APPROVED."
    },
    "supersededAt": {
      "type": "string",
      "format": "date-time",
      "description": "ISO 8601 timestamp Revision Manager writes when status flips to SUPERSEDED."
    },
    "supersededBy": {
      "type": "string",
      "pattern": "^revision-\\d{3,}$",
      "description": "ID of the revision that superseded this one."
    },
    "failure": {
      "type": "object",
      "additionalProperties": false,
      "required": ["stage", "summary"],
      "properties": {
        "stage": {
          "type": "string",
          "enum": ["compile", "render", "preview", "visual-diff", "test", "asset-resolve", "skill-validate", "architecture-map"],
          "description": "Pipeline stage that produced the failure."
        },
        "summary": {
          "type": "string",
          "minLength": 1,
          "description": "Short one-sentence failure description."
        },
        "message": {
          "type": "string",
          "description": "Verbatim error message from the failing stage."
        },
        "currentUsableDraft": {
          "type": ["string", "null"],
          "description": "ID of the most recent draft revision that still renders, when applicable."
        }
      },
      "description": "Present when status is FAILED. Records the failing stage and verbatim error so the orchestrator can route the next attempt."
    }
  },
  "$defs": {
    "artifactsWithLabels": {
      "type": "object",
      "properties": {
        "userRequest": { "type": "string", "minLength": 1 },
        "orchestrationDecision": { "type": "string", "minLength": 1 },
        "versionResolution": { "type": "string", "minLength": 1 },
        "skillValidation": { "type": "string", "minLength": 1 },
        "visualAnalysis": { "type": "string", "minLength": 1 },
        "architecturePlan": { "type": "string", "minLength": 1 },
        "assetRequest": { "type": "string", "minLength": 1 },
        "assetsManifest": { "type": "string", "minLength": 1 },
        "dataSchema": { "type": "string", "minLength": 1 },
        "data": { "type": "string", "minLength": 1 },
        "template": { "type": "string", "minLength": 1 },
        "test": { "type": "string", "minLength": 1 },
        "patch": { "type": "string", "minLength": 1 },
        "layoutSnapshot": { "type": "string", "minLength": 1 },
        "pdf": { "type": "string", "minLength": 1 },
        "preview": { "type": "string", "minLength": 1 },
        "previewPage2": { "type": "string", "minLength": 1 },
        "visualReview": { "type": "string", "minLength": 1 },
        "testResult": { "type": "string", "minLength": 1 },
        "status": { "type": "string", "minLength": 1 },
        "changedComponents": { "type": "string", "minLength": 1 }
      }
    }
  },
  "allOf": [
    {
      "description": "Scope-conditional artifact requirements. Fires only when `scope` is present, so existing scope-less revisions stay valid.",
      "if": {
        "required": ["scope"],
        "properties": { "scope": { "const": "visual-change" } }
      },
      "then": {
        "properties": {
          "artifacts": {
            "allOf": [
              { "$ref": "#/$defs/artifactsWithLabels" },
              { "type": "object", "required": ["userRequest", "visualAnalysis", "architecturePlan", "template", "test", "visualReview", "status"] }
            ]
          }
        }
      }
    },
    {
      "if": {
        "required": ["scope"],
        "properties": { "scope": { "const": "refactor-only" } }
      },
      "then": {
        "properties": {
          "artifacts": {
            "allOf": [
              { "$ref": "#/$defs/artifactsWithLabels" },
              { "type": "object", "required": ["userRequest", "template", "test", "visualReview", "status"] }
            ]
          }
        }
      }
    },
    {
      "description": "data-only inherits architecturePlan / visualAnalysis / assetsManifest from the parent revision; it does NOT produce its own copies.",
      "if": {
        "required": ["scope"],
        "properties": { "scope": { "const": "data-only" } }
      },
      "then": {
        "properties": {
          "artifacts": {
            "allOf": [
              { "$ref": "#/$defs/artifactsWithLabels" },
              { "type": "object", "required": ["userRequest", "visualReview", "status"] }
            ]
          }
        }
      }
    },
    {
      "description": "asset-only re-runs the resolver but inherits everything else from the parent.",
      "if": {
        "required": ["scope"],
        "properties": { "scope": { "const": "asset-only" } }
      },
      "then": {
        "properties": {
          "artifacts": {
            "allOf": [
              { "$ref": "#/$defs/artifactsWithLabels" },
              { "type": "object", "required": ["userRequest", "assetRequest", "assetsManifest", "visualReview", "status"] }
            ]
          }
        }
      }
    },
    {
      "if": {
        "required": ["scope"],
        "properties": { "scope": { "const": "theme-only" } }
      },
      "then": {
        "properties": {
          "artifacts": {
            "allOf": [
              { "$ref": "#/$defs/artifactsWithLabels" },
              { "type": "object", "required": ["userRequest", "template", "visualReview", "status"] }
            ]
          }
        }
      }
    },
    {
      "description": "FAILED revisions must carry the failure record, regardless of scope.",
      "if": {
        "properties": { "status": { "const": "FAILED" } },
        "required": ["status"]
      },
      "then": { "required": ["failure"] }
    },
    {
      "description": "SUPERSEDED revisions must record what superseded them.",
      "if": {
        "properties": { "status": { "const": "SUPERSEDED" } },
        "required": ["status"]
      },
      "then": { "required": ["supersededAt", "supersededBy"] }
    }
  ]
}
