{
  "id": "revision-002",
  "parentRevisionId": "revision-001",
  "status": "DRAFT",
  "userRequest": "Tighten alignment of the summary block under the line-items table.",
  "targetGraphComposeVersion": "1.6.0",
  "skillPack": "skills/versions/graphcompose-1.6",
  "changedComponents": [
    "LineItems",
    "Summary"
  ],
  "createdAt": "2026-05-18T15:00:00Z",
  "artifacts": {
    "userRequest": "user-request.md",
    "orchestrationDecision": "orchestration-decision.md",
    "versionResolution": "version-resolution.md",
    "skillValidation": "skill-validation-report.md",
    "architecturePlan": "architecture-plan.md",
    "template": "generated-template.java",
    "test": "generated-test.java",
    "patch": "patch.diff",
    "layoutSnapshot": "layout-snapshot.json",
    "pdf": "output.pdf",
    "preview": "output.png",
    "visualReview": "visual-review.md",
    "testResult": "test-result.md",
    "status": "status.md"
  },
  "pendingArtifacts": [
    "output.pdf",
    "output.png"
  ]
}
