{
  "id": "revision-002",
  "parentRevisionId": "revision-001",
  "status": "DRAFT",
  "userRequest": "Make the template from the supplied single-page corporate CV reference; continue the existing noir-corporate-cv project and replace the structural draft with real panels, shape badge, data spec, and render artifacts.",
  "targetGraphComposeVersion": "1.6.0",
  "skillPack": "skills/versions/graphcompose-1.6",
  "changedComponents": [
    "Header",
    "Sidebar",
    "Identity",
    "Contact",
    "Skills",
    "Languages",
    "Interest",
    "ProfessionalProfile",
    "Education",
    "WorkExperience",
    "DataSpec",
    "RenderRunner"
  ],
  "createdAt": "2026-05-19T10:30:00.000Z",
  "artifacts": {
    "userRequest": "user-request.md",
    "orchestrationDecision": "orchestration-decision.md",
    "versionResolution": "version-resolution.md",
    "skillValidation": "skill-validation-report.md",
    "visualAnalysis": "visual-analysis.md",
    "architecturePlan": "architecture-plan.md",
    "assetRequest": "asset-request.json",
    "assetsManifest": "assets-manifest.json",
    "dataSchema": "data-schema.md",
    "data": "cv-data.json",
    "template": "generated-template.java",
    "test": "generated-test.java",
    "layoutSnapshot": "layout-snapshot.json",
    "pdf": "output.pdf",
    "preview": "output.png",
    "debugPdf": "output-debug.pdf",
    "debugPreview": "output-debug.png",
    "visualReview": "visual-review.md",
    "testResult": "test-result.md",
    "status": "status.md"
  },
  "pendingArtifacts": [
    "layout-snapshot.json"
  ]
}
