{
  "id": "revision-002",
  "parentRevisionId": "revision-001",
  "status": "DRAFT",
  "userRequest": "Make the CV reference header rule full-width and replace skill-bar text with measured line markers",
  "targetGraphComposeVersion": "1.6.0",
  "skillPack": "skills/versions/graphcompose-1.6",
  "changedComponents": [
    "HeaderRule",
    "Skills"
  ],
  "createdAt": "2026-05-18T21:15:22.080Z",
  "artifacts": {
    "userRequest": "user-request.md",
    "orchestrationDecision": "orchestration-decision.md",
    "versionResolution": "version-resolution.md",
    "skillValidation": "skill-validation-report.md",
    "visualAnalysis": "visual-analysis.md",
    "architecturePlan": "architecture-plan.md",
    "template": "generated-template.java",
    "test": "generated-test.java",
    "layoutSnapshot": "layout-snapshot.json",
    "pdf": "output.pdf",
    "preview": "output.png",
    "previewPage2": "output-page-2.png",
    "visualReview": "visual-review.md",
    "testResult": "test-result.md",
    "status": "status.md"
  },
  "pendingArtifacts": []
}
