{
  "id": "revision-001",
  "parentRevisionId": null,
  "status": "DRAFT",
  "userRequest": "Create an A4 invoice template from the reference image.",
  "targetGraphComposeVersion": "1.6.0",
  "skillPack": "skills/versions/graphcompose-1.6",
  "changedComponents": [
    "Header",
    "Hero",
    "Parties",
    "LineItems",
    "Footer"
  ],
  "createdAt": "2026-05-18T12:30:00Z",
  "artifacts": {
    "userRequest": "user-request.md",
    "orchestrationDecision": "orchestration-decision.md",
    "versionResolution": "version-resolution.md",
    "skillValidation": "skill-validation-report.md",
    "visualAnalysis": "visual-analysis.md",
    "architecturePlan": "architecture-plan.md",
    "template": "generated-template.java",
    "test": "generated-test.java",
    "layoutSnapshot": "layout-snapshot.json",
    "pdf": "output.pdf",
    "preview": "output.png",
    "visualReview": "visual-review.md",
    "testResult": "test-result.md",
    "status": "status.md"
  },
  "pendingArtifacts": []
}
