{
  "id": "revision-003",
  "parentRevisionId": "revision-002",
  "status": "APPROVED",
  "userRequest": "Add page margins so invoice content is not flush to the top-left edge.",
  "targetGraphComposeVersion": "1.6.0",
  "skillPack": "skills/versions/graphcompose-1.6",
  "changedComponents": [
    "Page"
  ],
  "createdAt": "2026-05-18T20:02:12.513Z",
  "artifacts": {
    "userRequest": "user-request.md",
    "orchestrationDecision": "orchestration-decision.md",
    "versionResolution": "version-resolution.md",
    "skillValidation": "skill-validation-report.md",
    "architecturePlan": "architecture-plan.md",
    "template": "generated-template.java",
    "test": "generated-test.java",
    "patch": "patch.diff",
    "layoutSnapshot": "layout-snapshot.json",
    "pdf": "output.pdf",
    "preview": "output.png",
    "visualReview": "visual-review.md",
    "testResult": "test-result.md",
    "status": "status.md"
  },
  "pendingArtifacts": []
}
